{
  "$schema": "../schemas/impact-state.schema.json",
  "version": "1.0.0",
  "updatedAt": "2026-08-01",
  "authority": "public_aggregate_only",
  "organization": {
    "name": "Hacker Dojo",
    "tagline": "Keep the room where builders become possible.",
    "homepage": "https://www.hackerdojo.org/",
    "donationUrl": "https://www.every.org/hacker-dojo",
    "processor": "Every.org"
  },
  "campaign": {
    "name": "SupperHappyFundHouse Campaign",
    "eventDate": "2026-08-21",
    "currency": "USD",
    "minimumTarget": 420000.0,
    "stretchTarget": 2000000.0,
    "raisedPublic": 12840.0,
    "committedPublic": 2500.0,
    "donorCountPublic": 37,
    "lastReconciledAt": "2026-08-01T15:00:00Z",
    "status": "active",
    "raisedSource": "pilot_synthetic",
    "raisedClaimLabel": "PILOT"
  },
  "milestones": [
    {
      "id": "stabilize-ops",
      "label": "Stabilize operations",
      "threshold": 420000,
      "state": "open",
      "impact": "Keep the lights on and the room open for builders."
    },
    {
      "id": "growth-capacity",
      "label": "Growth capacity",
      "threshold": 750000,
      "state": "open",
      "impact": "Expand programs and community infrastructure."
    },
    {
      "id": "expansion",
      "label": "Expansion",
      "threshold": 1200000,
      "state": "open",
      "impact": "Scale space and builder pathways."
    },
    {
      "id": "transformation",
      "label": "Transformation path",
      "threshold": 2000000,
      "state": "open",
      "impact": "Fund the long-horizon transformation case under board governance."
    }
  ],
  "notifications": [
    {
      "id": "relay-online",
      "severity": "info",
      "title": "Impact Relay is live",
      "body": "Public aggregate donation progress and milestone notifications are now published from this repository. No personal donor data is stored here.",
      "publishedAt": "2026-08-01T14:00:00Z"
    },
    {
      "id": "reconciliation-pending",
      "severity": "warning",
      "title": "Live totals await reconciliation",
      "body": "Raised and committed amounts remain zero until an authorized Every.org export is reconciled into the public aggregate feed.",
      "publishedAt": "2026-08-01T14:05:00Z"
    },
    {
      "id": "uof-pilot-published",
      "severity": "success",
      "title": "Use-of-funds pilot receipts published",
      "body": "HD-IR-002 published privacy-safe use-of-funds receipts from the verified pilot fixture. Donor identity is not included.",
      "publishedAt": "2026-08-01T14:30:00Z"
    },
    {
      "id": "reconcile-2026-08-01",
      "severity": "success",
      "title": "Public donation aggregates updated",
      "body": "Synthetic aggregate-only Every.org-style summary. Not live processor data. Personal gifts must never appear here. Source: fixture://every.org/aggregate:hacker-dojo. Raised $12,840; committed $2,500; public donor count 37.",
      "publishedAt": "2026-08-01T15:00:00Z"
    },
    {
      "id": "notion-public-evidence",
      "severity": "info",
      "title": "Notion public evidence baseline loaded",
      "body": "Notion Public EvidencePack loaded: Form 990 contribution history and 2012 campaign aggregate are OBSERVED; live SupperHappyFundHouse raised remains NOT_COMPUTABLE until authorized processor aggregates arrive.",
      "publishedAt": "2026-08-01T16:00:00Z"
    }
  ],
  "privacy": {
    "classification": "public_aggregate_only",
    "piiAllowed": false,
    "donorNamesAllowed": false,
    "individualAmountsAllowed": false,
    "contactDataAllowed": false
  }
}
